{
  "$schema": "https://json-schema.org/draft/2020-12/schema",
  "$id": "https://cobbleventure.example/schema/npc-event-script.schema.json",
  "title": "Cobbleventure NPC event script",
  "type": "object",
  "additionalProperties": false,
  "required": ["schema_version", "id", "enabled", "name", "tags", "npc", "events"],
  "properties": {
    "$schema": { "type": "string" },
    "schema_version": { "const": 4 },
    "id": { "type": "string", "pattern": "^[a-z0-9_.-]+:npc/[a-z0-9_./-]+$" },
    "enabled": { "type": "boolean" },
    "name": { "$ref": "content-bundle.schema.json#/$defs/localized_text" },
    "description": { "$ref": "content-bundle.schema.json#/$defs/localized_text" },
    "tags": { "type": "array", "uniqueItems": true, "items": { "type": "string" } },
    "npc": { "$ref": "content-bundle.schema.json#/$defs/npc" },
    "events": {
      "type": "array",
      "minItems": 1,
      "items": {
        "type": "object",
        "additionalProperties": false,
        "required": ["id", "trigger", "commands"],
        "properties": {
          "id": { "type": "string", "pattern": "^[a-z0-9_.-]+$" },
          "trigger": {
            "oneOf": [
              {
                "type": "object",
                "additionalProperties": false,
                "required": ["type", "range"],
                "properties": {
                  "type": { "const": "interact" },
                  "range": { "type": "number", "exclusiveMinimum": 0, "default": 4 }
                }
              },
              {
                "type": "object",
                "additionalProperties": false,
                "required": ["type", "range"],
                "properties": {
                  "type": { "const": "proximity" },
                  "range": { "type": "number", "exclusiveMinimum": 0, "default": 4 },
                  "warning_offset": { "type": "number", "minimum": 0, "default": 2 },
                  "indicator": { "enum": ["trainer_nearby"] }
                }
              }
            ]
          },
          "commands": {
            "type": "array",
            "minItems": 1,
            "items": { "$ref": "#/$defs/command" }
          }
        }
      }
    }
  },
  "$defs": {
    "condition": {
      "type": "object",
      "required": ["type"],
      "properties": {
        "type": { "enum": ["flag_equals", "has_item", "always"] },
        "key": { "$ref": "content-bundle.schema.json#/$defs/resource_id" },
        "value": { "type": ["string", "number", "boolean"] },
        "item": { "$ref": "content-bundle.schema.json#/$defs/resource_id" },
        "count": { "type": "integer", "minimum": 1 }
      }
    },
    "command": {
      "type": "object",
      "required": ["type"],
      "properties": {
        "type": {
          "enum": [
            "branch", "label", "dialogue", "choices", "goto", "start_battle",
            "set_flag", "give_money", "give_item", "grant_loot", "end"
          ]
        },
        "conditions": { "type": "array", "minItems": 1, "items": { "$ref": "#/$defs/condition" } },
        "target": { "type": "string" },
        "name": { "type": "string" },
        "id": { "type": "string" },
        "speaker": { "enum": ["npc", "player", "system"] },
        "text": { "$ref": "content-bundle.schema.json#/$defs/localized_text" },
        "options": {
          "type": "array",
          "items": {
            "type": "object",
            "required": ["id", "text", "target"],
            "properties": {
              "id": { "type": "string" },
              "text": { "$ref": "content-bundle.schema.json#/$defs/localized_text" },
              "target": { "type": "string" }
            }
          }
        },
        "battle": { "$ref": "content-bundle.schema.json#/$defs/resource_id" },
        "results": {
          "type": "object",
          "properties": {
            "player_win": { "type": "string" },
            "player_loss": { "type": "string" },
            "cancelled": { "type": "string" }
          }
        },
        "key": { "$ref": "content-bundle.schema.json#/$defs/resource_id" },
        "value": { "type": ["string", "number", "boolean"] },
        "mode": { "enum": ["fixed", "level_cap_multiplier"] },
        "amount": { "type": "integer", "minimum": 0 },
        "multiplier": { "type": "number", "exclusiveMinimum": 0 },
        "currency_objective": { "type": "string" },
        "level_cap_objective": { "type": "string" },
        "item": { "$ref": "content-bundle.schema.json#/$defs/resource_id" },
        "count": { "type": "integer", "minimum": 1 },
        "loot_table": { "$ref": "content-bundle.schema.json#/$defs/resource_id" }
      }
    }
  }
}
