{
  "$schema": "../../../schemas/npc-event-script.schema.json",
  "schema_version": 4,
  "id": "cobbleventure:npc/gym_leader/misty",
  "enabled": true,
  "name": {
    "ko_kr": "이슬",
    "en_us": "Misty"
  },
  "description": {
    "ko_kr": "이슬 관장 NPC. another_red_misty_001 팀을 기준으로 한다.",
    "en_us": "Gym Leader Misty, based on another_red_misty_001."
  },
  "tags": [
    "trainer",
    "gym_leader",
    "kanto",
    "misty"
  ],
  "npc": {
    "display_name": {
      "ko_kr": "체육관 관장 이슬",
      "en_us": "Gym Leader Misty"
    },
    "trainer_class": "cobbleventure:trainer_class/gym_leader",
    "character": "cobbleventure:character/misty",
    "appearance": {
      "source": "rct_single",
      "type": "skin",
      "resource": "rctmod:trainers/single/kanto_misty"
    },
    "behavior": {
      "movement": "stationary",
      "look_at_player": true,
      "invulnerable": true,
      "collision": true
    }
  },
  "events": [
    {
      "id": "on_interact",
      "trigger": {
        "type": "interact",
        "range": 4.0
      },
      "commands": [
        {
          "type": "branch",
          "conditions": [
            {
              "type": "flag_equals",
              "key": "cobbleventure:flag/gym/kanto/misty/defeated",
              "value": true
            }
          ],
          "target": "cleared"
        },
        {
          "type": "label",
          "name": "challenge"
        },
        {
          "type": "dialogue",
          "id": "challenge",
          "speaker": "npc",
          "text": {
            "ko_kr": "체육관에 온 것을 환영한다. 준비가 됐다면 승부하자!",
            "en_us": "Welcome to my Gym. Challenge me when you are ready!"
          }
        },
        {
          "type": "choices",
          "options": [
            {
              "id": "battle",
              "text": {
                "ko_kr": "승부한다",
                "en_us": "Battle"
              },
              "target": "battle"
            },
            {
              "id": "cancel",
              "text": {
                "ko_kr": "다음에 도전한다",
                "en_us": "Not yet"
              },
              "target": "end"
            }
          ]
        },
        {
          "type": "label",
          "name": "battle"
        },
        {
          "type": "start_battle",
          "battle": "cobbleventure:battle/gym_leader/misty",
          "results": {
            "player_win": "victory",
            "player_loss": "defeat"
          }
        },
        {
          "type": "label",
          "name": "victory"
        },
        {
          "type": "set_flag",
          "key": "cobbleventure:flag/gym/kanto/misty/defeated",
          "value": true
        },
        {
          "type": "give_item",
          "item": "cobbleversebadges:kanto_cascade_badge",
          "count": 1
        },
        {
          "type": "dialogue",
          "id": "victory",
          "speaker": "npc",
          "text": {
            "ko_kr": "훌륭한 승부였다. 이 배지는 네 것이다.",
            "en_us": "An excellent battle. This Badge is yours."
          }
        },
        {
          "type": "goto",
          "target": "end"
        },
        {
          "type": "label",
          "name": "defeat"
        },
        {
          "type": "dialogue",
          "id": "defeat",
          "speaker": "npc",
          "text": {
            "ko_kr": "좋은 승부였다. 준비해서 다시 도전해라.",
            "en_us": "A good battle. Prepare and challenge me again."
          }
        },
        {
          "type": "goto",
          "target": "end"
        },
        {
          "type": "label",
          "name": "cleared"
        },
        {
          "type": "dialogue",
          "id": "cleared",
          "speaker": "npc",
          "text": {
            "ko_kr": "이미 실력을 증명했군. 다음 목표를 향해 나아가라.",
            "en_us": "You have already proven yourself. Move on to your next goal."
          }
        },
        {
          "type": "label",
          "name": "end"
        },
        {
          "type": "end"
        }
      ]
    }
  ]
}
